{
  "$schema": "https://w3id.org/osd/0.5/firmware.schema.json",
  "name": "TRIBE",
  "version": "0.3-beta",
  "device": {
    "descriptor": "m-vave/fm-1",
    "vendor": "M-VAVE",
    "model": "FM-1"
  },
  "author": [
    {
      "name": "apiel",
      "url": "https://github.com/apiel"
    }
  ],
  "repository": "https://github.com/apiel/fm1-tribe",
  "midi": {
    "descriptor": "m-vave/fm-1.vendor.fw-tribe-0.3-beta",
    "changes": "A ten-track groovebox: its own engines, clips and master controls."
  },
  "communities": [
    {
      "name": "fm1-tribe",
      "url": "https://discord.gg/fzHTbjh6x",
      "kind": "discord"
    }
  ],
  "license": "GPL-3.0",
  "homepage": "https://apiel.github.io/fm1-tribe/"
}
